{"$schema":"https://json-schema.org/draft/2020-12/schema","additionalProperties":false,"properties":{"bundles":{"additionalProperties":false,"properties":{"a":{"additionalProperties":false,"properties":{"ciphertext_sha256":{"pattern":"^[0-9a-f]{64}$","type":"string"},"destination":{"minLength":1,"type":"string"},"recipient_sha256":{"pattern":"^[0-9a-f]{64}$","type":"string"},"state":{"minLength":1,"type":"string"}},"required":["ciphertext_sha256","destination","recipient_sha256","state"],"type":"object"},"b":{"additionalProperties":false,"properties":{"ciphertext_sha256":{"pattern":"^[0-9a-f]{64}$","type":"string"},"destination":{"minLength":1,"type":"string"},"publication":{"additionalProperties":false,"properties":{"bytes":{"minimum":0,"type":"integer"},"ciphertext_sha256":{"pattern":"^[0-9a-f]{64}$","type":"string"},"encryption":{"minLength":1,"type":"string"},"object_key_sha256":{"pattern":"^[0-9a-f]{64}$","type":"string"},"state":{"minLength":1,"type":"string"},"version":{"minimum":0,"type":"integer"},"version_id_sha256":{"pattern":"^[0-9a-f]{64}$","type":"string"}},"required":["bytes","ciphertext_sha256","encryption","object_key_sha256","state","version","version_id_sha256"],"type":"object"},"recipient_sha256":{"pattern":"^[0-9a-f]{64}$","type":"string"},"state":{"minLength":1,"type":"string"}},"required":["ciphertext_sha256","destination","publication","recipient_sha256","state"],"type":"object"},"host_tokens_included":{"type":"boolean"},"physically_independent":{"type":"boolean"},"plaintext_sha256":{"pattern":"^[0-9a-f]{64}$","type":"string"}},"required":["a","b","host_tokens_included","physically_independent","plaintext_sha256"],"type":"object"},"cleanup":{"additionalProperties":false,"properties":{"destroy_state_sha256":{"pattern":"^[0-9a-f]{64}$","type":"string"},"plaintext_workspace":{"minLength":1,"type":"string"},"production_vm_sha256":{"pattern":"^[0-9a-f]{64}$","type":"string"},"vm_state":{"minLength":1,"type":"string"},"vmid":{"minimum":0,"type":"integer"}},"required":["destroy_state_sha256","plaintext_workspace","production_vm_sha256","vm_state","vmid"],"type":"object"},"commit":{"pattern":"^[0-9a-f]{40}$","type":"string"},"completed_at":{"pattern":"^[0-9]{4}-[0-9]{2}-[0-9]{2}T[0-9]{2}:[0-9]{2}:[0-9]{2}Z$","type":"string"},"restore":{"additionalProperties":false,"properties":{"activation_fixture":{"minLength":1,"type":"string"},"bundle_ciphertext_sha256":{"pattern":"^[0-9a-f]{64}$","type":"string"},"disk_provenance":{"additionalProperties":false,"properties":{"blank_sample_sha256":{"pattern":"^[0-9a-f]{64}$","type":"string"},"device_bytes":{"minimum":0,"type":"integer"},"edge_samples":{"minimum":0,"type":"integer"},"serial_sha256":{"pattern":"^[0-9a-f]{64}$","type":"string"},"state":{"minLength":1,"type":"string"}},"required":["blank_sample_sha256","device_bytes","edge_samples","serial_sha256","state"],"type":"object"},"external_user_data":{"minLength":1,"type":"string"},"production_vm_sha256":{"pattern":"^[0-9a-f]{64}$","type":"string"},"restore":{"additionalProperties":false,"properties":{"bytes":{"minimum":0,"type":"integer"},"files":{"minimum":0,"type":"integer"},"original_snapshot_id":{"pattern":"^[0-9a-f]{64}$","type":"string"},"plaintext_sha256":{"pattern":"^[0-9a-f]{64}$","type":"string"},"repository_id":{"pattern":"^[0-9a-f]{64}$","type":"string"},"snapshot_id":{"pattern":"^[0-9a-f]{64}$","type":"string"},"state":{"minLength":1,"type":"string"},"version":{"minimum":0,"type":"integer"}},"required":["bytes","files","original_snapshot_id","plaintext_sha256","repository_id","snapshot_id","state","version"],"type":"object"},"service_observation_after":{"additionalProperties":false,"properties":{"application_processes":{"minimum":0,"type":"integer"},"container_runtime_services":{"minimum":0,"type":"integer"},"containers":{"minimum":0,"type":"integer"},"observation_sha256":{"pattern":"^[0-9a-f]{64}$","type":"string"}},"required":["application_processes","container_runtime_services","containers","observation_sha256"],"type":"object"},"service_observation_before":{"additionalProperties":false,"properties":{"application_processes":{"minimum":0,"type":"integer"},"container_runtime_services":{"minimum":0,"type":"integer"},"containers":{"minimum":0,"type":"integer"},"observation_sha256":{"pattern":"^[0-9a-f]{64}$","type":"string"}},"required":["application_processes","container_runtime_services","containers","observation_sha256"],"type":"object"},"service_validation":{"additionalProperties":false,"properties":{"configuration_structure":{"minLength":1,"type":"string"},"database_integrity":{"minLength":1,"type":"string"},"external_user_data":{"minLength":1,"type":"string"},"representative_classes":{"minimum":0,"type":"integer"},"restored_files":{"minimum":0,"type":"integer"},"services_started":{"type":"boolean"},"state":{"minLength":1,"type":"string"}},"required":["configuration_structure","database_integrity","external_user_data","representative_classes","restored_files","services_started","state"],"type":"object"},"state":{"minLength":1,"type":"string"},"version":{"minimum":0,"type":"integer"},"vm_observation_sha256":{"pattern":"^[0-9a-f]{64}$","type":"string"},"vmid":{"minimum":0,"type":"integer"}},"required":["activation_fixture","bundle_ciphertext_sha256","disk_provenance","external_user_data","production_vm_sha256","restore","service_observation_after","service_observation_before","service_validation","state","version","vm_observation_sha256","vmid"],"type":"object"},"state":{"minLength":1,"type":"string"},"tools":{"additionalProperties":false,"properties":{"builder_sha256":{"pattern":"^[0-9a-f]{64}$","type":"string"},"consumer_sha256":{"pattern":"^[0-9a-f]{64}$","type":"string"},"vm_controller_sha256":{"pattern":"^[0-9a-f]{64}$","type":"string"}},"required":["builder_sha256","consumer_sha256","vm_controller_sha256"],"type":"object"},"type":{"minLength":1,"type":"string"},"version":{"minimum":0,"type":"integer"}},"required":["bundles","cleanup","commit","completed_at","restore","state","tools","type","version"],"type":"object"}
