{"bundles":{"a":{"ciphertext_sha256":"5b1b6aa85f69d750311d119d347ed4b269e7673218ca69f64277a104346d1a54","destination":"protected-local-recovery-storage","recipient_sha256":"f5b7517f9e2b0dfdf513e78f1297f94faf08bce9b30db97a894a1d3301423d1a","state":"encrypted-verified"},"b":{"ciphertext_sha256":"d42aa967ec9a137b0cfe9643c40c1fc1603363ea8bc3233e0ccc861fbda00f6f","destination":"protected-versioned-aws-recovery-storage","publication":{"bytes":116324264,"ciphertext_sha256":"d42aa967ec9a137b0cfe9643c40c1fc1603363ea8bc3233e0ccc861fbda00f6f","encryption":"aws:kms","object_key_sha256":"597d15ebe79ac54dbdd3a787867bf44c38379901e3dbd33a6e16d36898307324","state":"published-verified","version":1,"version_id_sha256":"d4045365396104d09bfc46fb193592033c04b4b908a8dbf22311feea150e467c"},"recipient_sha256":"492589a8d4a4a0670834f2d5ad9d6ef000186e66171d10d72740b9b30f20cbbf","state":"encrypted-published-restored"},"host_tokens_included":false,"physically_independent":true,"plaintext_sha256":"53e5cbadbeb341d692ed90aa70fe1c1f271186d1644a68dac925364019d98912"},"cleanup":{"destroy_state_sha256":"9ef07fa2803874a268e27e8b88309260d7060b2411fc8f28a6bd36676770359e","plaintext_workspace":"absent","production_vm_sha256":"edecafc32aa046ff1c13f443db52171a2114ddd13a6fa0e44713598f54f25e4b","vm_state":"absent","vmid":9900},"commit":"5931961f561de11a167858960b22555579b770c6","completed_at":"2026-08-26T13:40:17Z","restore":{"activation_fixture":"restic isolated activation fixtures passed","bundle_ciphertext_sha256":"d42aa967ec9a137b0cfe9643c40c1fc1603363ea8bc3233e0ccc861fbda00f6f","disk_provenance":{"blank_sample_sha256":"d6fe6395bda0cf7ff52878d08cfd9ce04eb3c78dc018d04fd6095bc43b0fe3b2","device_bytes":137438953472,"edge_samples":66,"serial_sha256":"68742fcb060b1aa86f93b98d3714b156d800f586bcaafe9c4d13b4502f2bac9b","state":"retained-exact-filesystem"},"external_user_data":"pending","production_vm_sha256":"edecafc32aa046ff1c13f443db52171a2114ddd13a6fa0e44713598f54f25e4b","restore":{"bytes":6982221998,"files":22031,"original_snapshot_id":"edd4f507cec382e6fae48e2690ffa53ae7ef7a61e24581983975631cbe5a32e2","plaintext_sha256":"53e5cbadbeb341d692ed90aa70fe1c1f271186d1644a68dac925364019d98912","repository_id":"d1faa9cd772dd13275b8d4db376c2bbba0b82a9415a28b0d03a8b17e37b7fb7e","snapshot_id":"95be7e9b0a03cedd06340fdcf63055c67205c3a6c28687ffd2dc99e733bfa71e","state":"restored-verified","version":1},"service_observation_after":{"application_processes":0,"container_runtime_services":0,"containers":0,"observation_sha256":"dcdfc9ab6f70d58d229604bc0fb8443c129aca97e55079f7cf55e02b74024b40"},"service_observation_before":{"application_processes":0,"container_runtime_services":0,"containers":0,"observation_sha256":"77b3093f16bc50548440b5bed988b1188e83cdee8c60db67ba5ca4ab3c75a076"},"service_validation":{"configuration_structure":"pass","database_integrity":"pass","external_user_data":"pending","representative_classes":6,"restored_files":22033,"services_started":false,"state":"validated"},"state":"restored-verified","version":1,"vm_observation_sha256":"16e0da3106769f07db4306c103d1926a42445fdb7ab502e9ff1675d01519e99b","vmid":9900},"state":"completed","tools":{"builder_sha256":"1f55aa0138717963e874b06b8ed4944bead8f5c16e83d5f94c01982e7fc93e69","consumer_sha256":"4ee2d85bd8efdd92cbc7dccb0be7aba117f4952ff7e06519fd4ab9702cbf0f61","vm_controller_sha256":"a9207836eda196c28e8781e416cc96d6045d1d61c87060707ebbbc6ee0c7ec5c"},"type":"restic-restore-proof","version":1}
